user;waktu;sentimen;lokasi;ulasan
Rita Sehan;3 tahun lalu;Negatif;Bukit Jaddhih;Hanya pemandangan bukit kapur saja, selebihnya tidak ada apa2 disana, danau nya juga kering
Yuliarta Kurnia Pramai Sella;11 bulan lalu;Negatif;Bukit Jaddhih;Ketika melihat pola kerukannya, nambangnya penuh dgn perhitungan.
Tommy Hutama;9 bulan lalu;Positif;Bukit Jaddhih;Lokasi wisata dikelola oleh masyarakat sekitar, sehingga menimbulkan kesan yang amburadul. Tidak ada lokasi parkir yang memadai. Harga tiket relatif murah, 5rb/orang.
Rina Andriani;4 tahun lalu;Negatif;Bukit Jaddhih;Belum terawat, masih banyak pungli utk tiket masuk
Ananda Nico Ardiansyah;5 tahun lalu;Negatif;Bukit Jaddhih;Tempat cocok untuk rekreasi. Namun hati2 untuk yang berangkat sendirian atau berduaan. Karena banyak begal
Ricky Marlissa;setahun lalu;Positif;Bukit Jaddhih;"Spot Foto dengan latar bukit kapur bekas galian tambang.

Toilet gelap tdk ada lampu. …"
Nunung Wahyudi SP;setahun lalu;Positif;Bukit Jaddhih;Lahan luas ... cocok buat wisata yg dekat dengan Surabaya. Buat foto-foto prewedding, dan keluarga. Tiket parkir motor 10rb .dan tikect  masuk 5000 perorangan.  Disarankan bawa payung , dan kondisi sehat supaya bisa jalan² tanjakan bisa di …
RINA AZCHAR;4 tahun lalu;Positif;Bukit Jaddhih;Tempat wisatanya lumayan bagus, tp panas
fardha fadillah;3 tahun lalu;Positif;Bukit Jaddhih;"Bagus sih tmpt nya??, tp nggak ada tmpt buat berteduh
Panas bgt???? …"
Dyah Ayu NS;5 tahun lalu;Positif;Bukit Jaddhih;Tempat tambang kapur. Bagus tempatnya. Sayangnya jalan kecil menuju lokasi kalau habis hujan jadi becek berlumpur. Sehingga agak berbahaya untuk pengendara motor.
Bayu Adi Wibowo;5 tahun lalu;Positif;Bukit Jaddhih;"tidak seindah dan sebagus 1-2 tahun lalu
kondisi danau buatan sangat mengenaskan"
Adista Cista;4 tahun lalu;Positif;Bukit Jaddhih;Keren pemandangannya sayangnya jalannya kurang terbenahi
Thobias Andhika;4 tahun lalu;Positif;Bukit Jaddhih;Tempatnya menarik kalau di explore lagi, banyak hidden spot yang sepi banget jauh dari wisatawan pada umunya.
karlos david;4 bulan lalu;Positif;Bukit Jaddhih;"Wajib sun glasses & sun cream
Selebihnya wow & indah"
Muhammad Farid;4 tahun lalu;Positif;Bukit Jaddhih;Keren, sebuah tempat bekas pertambangan yg dijadikan tempat wisata
dianawek dian;3 tahun lalu;Positif;Bukit Jaddhih;"Keren bnget.. Unik dengan ukiran batu kapur yg dibentuk sedemikian rupa

Cukup dengan 35rb saja..  Video lebih lanjut bisa tonton dichannel
youtube dianawek dian"
blue night;4 tahun lalu;Positif;Bukit Jaddhih;Bagus rek..cm kl k sana bagusan pas sunset ato pagi sekalian
Rommy Perdana Putra;3 tahun lalu;Negatif;Bukit Jaddhih;Banyak preman dan panas sekali. Jadi tidak nyaman untuk berwisata.
rya arista;4 tahun lalu;Positif;Bukit Jaddhih;Danaunya kyk gak terawat, aksesnya jg kurang bagus, tp mayan seh buat foto2
Incam Sudarmadi;2 tahun lalu;Positif;Bukit Jaddhih;Mestinya ada wisata pakai jeep dari suramadu ke bukit jaddih.. kebayang asyiknya sih lewat sawah2, jalan makadam dan bisa muter2 di bukit ???? …
AR1 CHANEL;4 tahun lalu;Positif;Bukit Jaddhih;Tempat nya bagus,  sangat di sayangkan Pungli Pungli juga,  jalan masuk lokasi juga sangat bagus  dan Sangat di harapkan dinas parawisata yamg berkaitan Tolong di benahi.
budi mega prasetyo;4 tahun lalu;Positif;Bukit Jaddhih;Penambangan kapur yang dijadikan obyek wisata. Lebih besar dari tebing breksi, sangat potensial. Masih sedang dikembangkan
JUANDFI CHANNEL;4 tahun lalu;Positif;Bukit Jaddhih;Sangat bagus dan keren buat foto..
Paramita Setiarani;4 tahun lalu;Positif;Bukit Jaddhih;Tempatnya bagus, sayang panas nya menyengat.
Hari Hartono;4 tahun lalu;Positif;Bukit Jaddhih;Bagus sekali. Sangat potential untuk dikembangkan. Akses jalan dan pengelolaan obyek wisata perlu ditingkatkan
anthony enrico;5 tahun lalu;Positif;Bukit Jaddhih;Pemandanganya bagus, klo kesini mendingan di sore hari. Supaya tidak kena terik matahari yg panas
vina mila;setahun lalu;Positif;Bukit Jaddhih;Nice place n klo pinter cari spot foto pasti kece .. ???? …
arum “Sari” puspa sari;5 tahun lalu;Positif;Bukit Jaddhih;Bagus tapi menyeramkan ??. Kalo berangkat sama2 cewe. Jalanan curam. Mending naik mobil pas kesini soalnya debunya bertebaran. Trus danaunya kalo pas musim panas ijo enggak biru lagi. …
Kimi Hikari;3 tahun lalu;Positif;Bukit Jaddhih;Disini pemandangan dari atas sangatlah indah, dengan dikelilingi pegunungan kapur. Menjadi tempat yang sangat menarik
Septian Anom Atmojo (Anom);4 tahun lalu;Negatif;Bukit Jaddhih;Nggak tau sih, menurutku sistem administrasi nya kurang tertata, but lumayan
Mas Purwo (Mas Purwo);4 tahun lalu;Positif;Bukit Jaddhih;Buat spot photo aja sih klo LG kemarau
HONDA ASTREA SERIES Surabaya - Sidoarjo;2 tahun lalu;Negatif;Bukit Jaddhih;"Akibat keserakahan manusia bukit jaddih lama"" akan hilang"
Demes Mustika;4 tahun lalu;Negatif;Bukit Jaddhih;Panas. Dan mahal tiket nya. Masa disuruh bayar 2 kali. 2 org 40rb . Tempat nya mengecewakan. Parahh
Maulida al fita;4 tahun lalu;Positif;Bukit Jaddhih;Tempat nya bagus untuk tiket masuk 30. Kalau mau naik keatas harus nambah biaya padahal tmpt sama saja
Dwi Rahmawan;5 tahun lalu;Positif;Bukit Jaddhih;Ada perahu buat foto ada juga kolam renang
bedjo setijawan;3 tahun lalu;Positif;Bukit Jaddhih;Tempat wisatanya bagus eksotis,,,bagus utk wawasan perbukitan keras
binda banatau;5 tahun lalu;Positif;Bukit Jaddhih;Pilihan wisata yang bagus, hanya saja terlalu banyak preman. Dikit2 bayar.
Leni Edi;4 tahun lalu;Positif;Bukit Jaddhih;Tempatnya artistik ..bagus u foto spot.. cuman agak panas..
Teguh Sinulingga;4 tahun lalu;Positif;Bukit Jaddhih;Tempat penggalian kapur yang dijadikan tempat wisata
Rio Zulfikar;4 tahun lalu;Positif;Bukit Jaddhih;Bukitnya tidak buruk, lumayan buat foto2, hawanya panas
Yeni Sisnawati;4 tahun lalu;Positif;Bukit Jaddhih;Jng bagus viewnya utk swa berfoto
Tya Tiyul;2 tahun lalu;Negatif;Bukit Jaddhih;Akses masih buruk, akan lebih baik juga jika diberikan penunjuk arah masuk dan keuar. Karena sangat membingungkan
Agus Yuliyanto;2 tahun lalu;Positif;Bukit Jaddhih;"View nya bagus
Tempatnya dingin dan sejuk"
Rian Prio Bramantio;4 tahun lalu;Positif;Bukit Jaddhih;Perlu ditingkatkan dan dikembangkan lagi agar lebih atraktif dan menarik.
Egha Fitri;5 tahun lalu;Positif;Bukit Jaddhih;Bagus...tapi panasnya mintak ampunnnn??gpp yg penting seru?? …
Hidayat Hadi;4 tahun lalu;Positif;Bukit Jaddhih;"Bagusss sekali cumaa PUNGLINYA ITULOHH....  WAGELASEEEHH!!  bikin gak lagi lagi kesana sebelum bener bener di atur tur tur..  Jalan berapa meter bayar ...jalan lagi bayar...  Jalan lagi bayar...  -.-"") keterlaluan sih menurutku."
fitri octavianie;4 tahun lalu;Positif;Bukit Jaddhih;Tempat nya keren banget.. Dri awal. Masuk ada pungutan biaya...
sulis susantok;4 tahun lalu;Negatif;Bukit Jaddhih;Kurangnya penunjuk jalan, lokasi yg berdebu namun di goa pote lumayan dingin dan sejuk,  lokasi berdebu karena area tambang batu kapur
Fiko Agung;4 tahun lalu;Positif;Bukit Jaddhih;Pertambangan kapur yang di jadikan objek wisata,  ada goa2 buatan,  danau dan tebing2 kapur.
Arul Varizers;11 bulan lalu;Positif;Bukit Jaddhih;Bukit jaddih merupakan destinasi yang menarik untuk dikunjungi ketika berada di Madura. Bukit Jaddih ialah destinasi berupa tambang kapur yang memiliki pemandangan yang Instagramable. …
Niko San;5 tahun lalu;Positif;Bukit Jaddhih;Danau yang di bawah kurang bagus. Lebih bagus naik le atas bukitnya. Viewnya mantap.
Innararetya Khadijah6A;3 tahun lalu;Positif;Bukit Jaddhih;Bulan Agustus kesana..  Danaunya surut.. pdhal klo pas airnya penuh lebih bagus
M. Hilal Nur Anshori (Hils);4 bulan lalu;Negatif;Bukit Jaddhih;"Lagi lagi
SDM nya penduduk sana?? …"
Versaputra Avecenna;11 bulan lalu;Negatif;Bukit Jaddhih;Oct 2022, ga seputih tahun 2016.
oyik oyik;5 tahun lalu;Positif;Bukit Jaddhih;Tempat nan indah dan sempurna untuk berpose serasa berada di dunia dongeng
Adventina Permata cahya;4 tahun lalu;Positif;Bukit Jaddhih;Banyak tukang parkir abal2 yang minta biaya parkir padahal kami sudah bayar parkir di depan, selebihnya bagus viewnya
Rama Dani;setahun lalu;Positif;Bukit Jaddhih;Pemandangannya sangat ?????? …
Asriandi Kautsar;8 bulan lalu;Positif;Bukit Jaddhih;Melihat tambang kapur yg diubah jadi obyek wisata. Pakai sunscreen atau alat pelindung, di siang hari panas sekali
Benediktus Kristiadi;4 tahun lalu;Positif;Bukit Jaddhih;Kerennn tempatnya cocok untuk bersantaii ?? …
Muhammad bin rachmad;5 bulan lalu;Positif;Bukit Jaddhih;Setelah nyampe kita disuguhkan hamparan bukit kapur yg indah
Fitri Handayani;4 tahun lalu;Positif;Bukit Jaddhih;Semua bagus..  Sayangnya toiletnya airnya kotor
Bangun Pagi;3 tahun lalu;Negatif;Bukit Jaddhih;sangat recomend sayang banyak pungli. harus ditindak tegass
budiharjo gitowiryono;4 tahun lalu;Positif;Bukit Jaddhih;pada dasarnya bagus, namun masih perlu banyak perbaikan dan pengembangan
elizabeth wulandari;5 tahun lalu;Positif;Bukit Jaddhih;Bagus tapi panas bgt, banyak restribusi yg gak jelas, penunjuk arah tidak jelas
Info Property Malang & Batu;3 tahun lalu;Positif;Bukit Jaddhih;Tempat penambangan batu kapur, hati-hati untuk pengunjung dengan kendaraan roda 2 lebih baik pergi berkelompok.mi
Annyssa Maylia;4 tahun lalu;Negatif;Bukit Jaddhih;Pas otw kesana harus hati2 soalnya banyak banget yg narikin uang gk jelas. Terus tiba2 pas udh diatas dimintain uang tiket msuk padahal td d bawah udh bayar.  Hati2 ya guys
Annisa Fira;5 tahun lalu;Positif;Bukit Jaddhih;Tempatnya bagus buat foto. Biayanya murah meriah,cuma 10 ribu per 2 orang plus motor.
Dian Andriani;11 bulan lalu;Positif;Bukit Jaddhih;Bukit Yang Bagus dan Indah gk rugi rekreasi ke sini
anita suryani;10 bulan lalu;Negatif;Bukit Jaddhih;Sepiiiiii g ad apa2 nyaaa .. kurang seru
Januar Khaidir;2 bulan lalu;Positif;Bukit Jaddhih;Mungkin lebih bagus kesana klo musim hujan
The OinK;4 tahun lalu;Positif;Bukit Jaddhih;Bagus tempat nya... tapi jalan menuju lokasi perbaikin dunk....
alifah febrian;3 tahun lalu;Positif;Bukit Jaddhih;Walaupun panas dan debu, tapi ntah lah suka aja sama tempat ini.. kece bgttt ???????? …
Pak Ardi Ganteng;setahun lalu;Positif;Bukit Jaddhih;Panas kalo siang... Tapi kalo pagi atau sore lebih aku saranin sih
Rio Al-Hilmiy;5 tahun lalu;Positif;Bukit Jaddhih;Sudah mulai di perbaiki menjadi tempat Wisata
Yuliana Ana;4 tahun lalu;Negatif;Bukit Jaddhih;Tempatnya panas siap2 bawa payung. Terlalu banyak retribusi menjengkelkan.
Stefani Gabriela;5 tahun lalu;Positif;Bukit Jaddhih;Bagus tetapi terlalu banyak pungutan liar.
Rini Cahaya;4 bulan lalu;Positif;Bukit Jaddhih;Keren tempat ya buat yg suka foto2 vibes ya mantap
Abdillah MT;5 tahun lalu;Positif;Bukit Jaddhih;Bukit kapur yang indah. Terdapat danau kecil berwarna biru di lembahnya. Bagus unutk wisata disekitar Madura dekat dengan jembatan Suramadu.
Dyah Anr;4 tahun lalu;Negatif;Bukit Jaddhih;"Tempatnya asli, asli panas??
Untuk masuk kesana kudu bayar 3x
Pertama seikhlasnya …"
okta viana nurrohmah;5 tahun lalu;Positif;Bukit Jaddhih;Tambang batu putih di Madura menjadi daya tarik wisata
Vina Himma;4 tahun lalu;Positif;Bukit Jaddhih;Bagus banget tempatnyaa. Cocok buat refreshing
Adi Irawan;5 tahun lalu;Positif;Bukit Jaddhih;Panas sekali, tapi untuk view foto banyak spot yang keren
Anna Dh;setahun lalu;Positif;Bukit Jaddhih;Sukaaa banget  panoramanya dan terima kasih banyak buat bpak yg fotoin kita
073_ Nanda D Kartika;5 tahun lalu;Positif;Bukit Jaddhih;Bagus untuk dikunjungi, untuk teman2 yang lagi main kemadura
Latiful Hisyam;5 tahun lalu;Positif;Bukit Jaddhih;Tempat nya asi...pemandangan nya juga  agus cocok buat yang suka adventure
Erza Minatullah;5 tahun lalu;Positif;Bukit Jaddhih;Puanase poll! Tapi keren banget lah buat pepotoan!!
Alfan Ramadhan;5 tahun lalu;Positif;Bukit Jaddhih;"Ini tempat yang indah dan ini bisa untuk di petualangan ni
Dan bisa ngajak keluarga dan teman teman"
Sal Sali;4 tahun lalu;Positif;Bukit Jaddhih;Bagus buat spot foto. Tapi kalo kesana disarankan lewat Bangkalan Kota untuk yg cuma rombongan 2 orang atau 4 orang
Sardani Muhammad;5 tahun lalu;Positif;Bukit Jaddhih;Bukit dgn panorama yg luar biasa indah..
No Name;4 tahun lalu;Negatif;Bukit Jaddhih;Puanas,persiapan bawa kacamata hitam biar ngga silau
Rocky Hermawan (Rocky);5 tahun lalu;Positif;Bukit Jaddhih;Tempatnya sih bagus tapi tempatnya berdebu, lokasinya agak masuk dari jalan utama
muhammad fauzi;9 bulan lalu;Positif;Bukit Jaddhih;Viewnya bagus, tapi belum di tata dengan baik...
Martinus Ng;setahun lalu;Positif;Bukit Jaddhih;Wisata tambang batu kapur. Mungkin karena belum di kelola baik jadi fasilitas seadanya. Masuk gerbang dipungut Rp 20.000. Sampai dalam setengah dipaksa bayar Rp 5000 tanpa karcis. Buat foto2 cukup bagus dan ada danau buatan dan goa goa
enna najma;4 tahun lalu;Positif;Bukit Jaddhih;Wisata alam dengan memanfaatkan bekas pertambangan, sangat cocok untuk selfi, lokasinya juga dekat dengan makam mbah kholil
Ersa Azizah;3 tahun lalu;Positif;Bukit Jaddhih;Saran saya kalau kesini menjelang sore aja supaya matahari agak redup. Mengingat tanahnya adalah batu kapur, warnanya putih, jadi silau banget di mata. Sumpah. Kalian wajib pake kacamata hitam biar mantap foto2nya. …
Lucky Indriana;setahun lalu;Negatif;Bukit Jaddhih;Tidak direkomendasikan untuk mengendarai sepeda motor karena medan berupa batuan kapur berlumut yang bisa menyebabkan sepeda motor tergelincir. Sedia sunscreen dan masker karena suhu udara sangat panas dan berdebu akibat proses penambangan batuan kapur.
Bebe Donk;setahun lalu;Negatif;Bukit Jaddhih;"Wisata eks penambangan batu (kapur)

Waktu akan masuk ke lokasi wisata, pengunjung dikenakan bea masuk : …"
arief;3 tahun lalu;Positif;Bukit Jaddhih;Tempatnya panas kalok siang hari tapi semua itu terbayarkan dengan view yg begitu indah....
arfan wijaya;3 tahun lalu;Positif;Bukit Jaddhih;Tambang bukit kapur yg lumayan cantik... Sayangnya kebanyakan yg narik duit. Ga jelas mana yg resmi mana yg bukan.
Farouk Yufara;5 tahun lalu;Positif;Bukit Jaddhih;klo hari libur atau tanggal merah rame bgt..akses lwt sana lebih enak arah dr terminal bangkalan
Aditya Nugroho;4 tahun lalu;Positif;Bukit Jaddhih;Tempatnya bagus buat foto foto dan unik
Salama Amah;setahun lalu;Negatif;Bukit Jaddhih;Minusnya cuma kurang terawat aja
yosua christian;4 tahun lalu;Positif;Bukit Jaddhih;Tempatnya Bagus, tpi tidak pengelolaan dari pemerintahan, jadi pemalakan liar masih sering ditemui
kentank;4 tahun lalu;Positif;Bukit Jaddhih;Tempatnya bagus di luar ekspektasi, untuk masuknya kemaren gratis sih pas pagi, gatau tapi bayar atau ga.
Depi Kurnia;8 bulan lalu;Positif;Bukit Jaddhih;Sangat eksotis dan bagus
dayat rahmad;5 tahun lalu;Positif;Bukit Jaddhih;Sudah dua kali kesini view nya gak kalah sama yg diluar negri apa lagi saya sudah kedua kali ke bukit jeddih audah banyak yg diperbaiki ramah untuk wisata
Hesti Dewie;3 tahun lalu;Positif;Bukit Jaddhih;"viewnya bagus ....
musti bawa kacamata hitam biar g silau krn pantulan tebing"
Agus Budianto;2 tahun lalu;Positif;Bukit Jaddhih;Semakin keren saja bukit kapur yang ada di ujun barat pulau madura ini ???? …
teambull gerry;3 tahun lalu;Positif;Bukit Jaddhih;Bagus dan indah sayang kurang dikelola dengan baik sebagai obyek wisata
bibit rosida;4 tahun lalu;Positif;Bukit Jaddhih;Bukan kali pertama kesini... Tp rasanya masih banyak sudut yg belum terekspose....
Anna Wijayanti;5 tahun lalu;Positif;Bukit Jaddhih;Spot foto bagus tp sayang banyak pungli dan preman. Orang2 nya tdk bersahabat.
davit rijadi;5 tahun lalu;Positif;Bukit Jaddhih;Tempat yg bagus unt foto2...agak panas..tp cukup menyenangkan
the skinny feet;3 tahun lalu;Positif;Bukit Jaddhih;Sekedar nostalgia Ini photo pas jaddih masih awal awal tenar , sampai skrng belum kesini lagi terakhir liat skrng udah mirip kyk di iceland
Singgih Junaedi;4 tahun lalu;Positif;Bukit Jaddhih;Bagus juga asal bisa ambil spot yg bagus untuk foto
Irawan Sukma;5 hari lalu;Negatif;Bukit Jaddhih;Masuk lokasi kebanyakan tiket .......
Santi Octavia;4 tahun lalu;Positif;Bukit Jaddhih;Tempat yang bagus dan keren untuk foto2... intragamble...
Nurman Riyadi Rahman;5 tahun lalu;Positif;Bukit Jaddhih;Tempat yang bagus dengan pemandangan batu kapur yang unik. Recommended buat pecinta fotografi
Dito Channel;4 tahun lalu;Positif;Bukit Jaddhih;Tempat keren, lebih keren kalau akses jalannya lebih bagus.
shofan azizi;9 bulan lalu;Positif;Bukit Jaddhih;Suasana bagus, tapi sistem karcis yang menurut saya kurang enak, seolah olah ada pungli...
Ruth Melissa;7 bulan lalu;Negatif;Bukit Jaddhih;Banyak pungli, pelayanan sangat tidak ramah, kesannya memalak, tempat tidak terawat,
Peka Yuliantoro;2 tahun lalu;Positif;Bukit Jaddhih;Keren, semoga lebih maju, penataannya, keamanan dan kenyamanan pengunjung
Ilham Fatahillah;4 tahun lalu;Positif;Bukit Jaddhih;Indahnya tak seperti dulu.. Kata teman yg saya ajak. Tak seperti ekspektasinya.
Ardian Rahcman Prasetiyo;4 tahun lalu;Positif;Bukit Jaddhih;Wisata di madura yang foto instagramable dan mueah . Ini foto jaddih 2 tahun lalu
Indahsriw Wulandari;4 tahun lalu;Positif;Bukit Jaddhih;Waktu nyampai sana hampir sore jadi gak begitu panas
Muhammad Asri;2 tahun lalu;Negatif;Bukit Jaddhih;Kurang terawat. Sistem tiket masuk buruk.
Bagus Kurniawan;5 tahun lalu;Negatif;Bukit Jaddhih;Kurang tertata (semrawut) pengalaman masuk harus bayar 2X.. Spot foto kurang ?? …
zheen mradas;4 tahun lalu;Positif;Bukit Jaddhih;Salah satu pemandangan yang aan memajakan mata pengunjung
Salsalah;4 tahun lalu;Positif;Bukit Jaddhih;Satu2nya bukit kapur yang berwarna putih di bangakalan madura, mayoritas masyarakat tergolong ramah tamah
Achmad Shodiq;4 tahun lalu;Positif;Bukit Jaddhih;Spot istimewa untuk berfoto selfie
Rully Amrullah;5 tahun lalu;Negatif;Bukit Jaddhih;Siap bawah yang pecahan 10rb....banyak pungli
Raditya Rizky Apriansyah;5 tahun lalu;Positif;Bukit Jaddhih;Pakai masker pakai helm pakai boot dan jangan lupa kacamata kalo mau kesini, sejam jadi penambang kapur
Yuslimul marufa;4 tahun lalu;Positif;Bukit Jaddhih;Tempatnya bagus dan berpotensi hanya saja akses ke sana belum terlalu mudah.
Giyanto Giyanto;setahun lalu;Positif;Bukit Jaddhih;Kapok saya kesana....baru belok dari jalan aspal menuju lokasi sudah ada tarikan 10 rb. Masuk lokasi ada tarikan 20 rb. Terus masuk parkir untuk foto foto ada tarikan 20 rb. Pindah ke spot yg lain ada tarikan 20 rb lagi.... Bosan disana …
Pistachio;4 tahun lalu;Positif;Bukit Jaddhih;"Tempatnya sangat bagus, kalo pagi2 banget sekitar jam  setengah 7 kesini terus foto2 berasa kayak ada di gunung Es.
Menuju siang cuaca panas, saya sarankan pakai sunblock/sunscreen, berasa ada di …"
Jo Be;5 tahun lalu;Positif;Bukit Jaddhih;"Kurang rekomendasi untuk tempat rekreasi keluarga
Untuk foto-foto tempat lumayan bagus ?? …"
Internusa HeatingElement;setahun lalu;Positif;Bukit Jaddhih;Mengecewakan sekali, banyak pungutan liar. Belok dari jalan aspal menuju lokasi dah kena 10 rb. Masuk lokasi kena 20 rb. Masu ke area kena 20 rb. Pindah mobil kena 20 rb. Pindah mobil lagi untuk foto foto kena 20 rb. Kapoooook saya kesana... Pungutan liar tok...
Gilang Ramadan;sebulan lalu;Negatif;Bukit Jaddhih;Pas lg kemarau danaunya kering
Rigukkk Saputra;2 tahun lalu;Positif;Bukit Jaddhih;"Jangan kesini pas siamg hari ya...
Alamat g bisa foto²"
Rubi Strubi;3 tahun lalu;Positif;Bukit Jaddhih;tempat wisata yang unik dan  bagus
Sindi Seviani;5 tahun lalu;Positif;Bukit Jaddhih;Bagus tp masih banyak pungli
rizki santoso;3 tahun lalu;Positif;Bukit Jaddhih;Tempat asik, hati hati saat hujan, karena jalanan berbatu
dwi yuliantoro;4 tahun lalu;Positif;Bukit Jaddhih;Prospek bagus untuk tempat pariwisata,, perlu dikembangkan lagi..
lupita sari;4 tahun lalu;Positif;Bukit Jaddhih;Bagus sihh view nya, tapi banyak banget bayar bayar di setiap tempat
Anvi Ridatus;9 bulan lalu;Positif;Bukit Jaddhih;Tempat bagus, culture date bisa kali ya hehe, cuman kalo siang hari panas bet ampe memicing ini mata
Devit Wahid Subekti;5 tahun lalu;Positif;Bukit Jaddhih;"Tempat wisata yang keren..
Tapi terlalu banyak pos pembayaran tiket"
Fierna Tri Rachmadhevy;5 tahun lalu;Negatif;Bukit Jaddhih;Tempat nya gersang disini jd usahakan bawa masker, danau nya ternyata warna ijo bukan biruuu
Dian Widyaningtyas;setahun lalu;Positif;Bukit Jaddhih;Nggak secantik dulu
Kezia Tan;3 tahun lalu;Positif;Bukit Jaddhih;Pemandangannya bagus kok di sana. Tempatnya instagram-able juga. Tapi sayang banyak pungli dari warga lokal. Pertama disuruh bayar kas kampung 10ribu, di dalem masih harus bayar lagi tiket masuk per orang, setelah di tempat parkir juga …
Etha Dewi;5 tahun lalu;Positif;Bukit Jaddhih;Baguss sih , cuma hati hati aja , bnyak tarikan liar
yudha setya;4 tahun lalu;Positif;Bukit Jaddhih;Sebaiknya bawa kacamata hitam, guna mengurangi silau
Ifsan Dwinanto;5 tahun lalu;Positif;Bukit Jaddhih;Mantap buat selfie n jalan2 murah meriah di pulau madura
beeflow88;5 tahun lalu;Positif;Bukit Jaddhih;Pemandangannya bagus. Walaupun jalannya jelek.
tyan yulistyawan;5 tahun lalu;Positif;Bukit Jaddhih;Hmm....cukup panas...tpi lmayan bagus..
Kang Huda;4 tahun lalu;Positif;Bukit Jaddhih;mantab sekali,,hanya saja wisata ini belum jadi,,mungkin 10 tahun lagi bukit ini akan menjadi bukit yg istimewa
eko genrush;setahun lalu;Negatif;Bukit Jaddhih;Jalannya Jelek banget, sementara bayarnya Masuk Mobil bayar mahal mobil 20rb, Elf/30rb, Bis tanggung/50rb, Bus besar/80rb, kalau di lokasi 5000/pengunjung
arif Irja;2 tahun lalu;Negatif;Bukit Jaddhih;Sptnya sdh tdk semenarik waktu awal2 dibuka ditambah banyaknya yg melakukan pungutan yg tdk resmi, minim sarpras penunjang, kurangnya petunjuk jalan ke tempat wisata dimaksud ditambah pandemi, menjadikannya sepi pengunjung. Kasihan orang2 …
Felicia Kleantha Setiadi;setahun lalu;Positif;Bukit Jaddhih;harga tiket 5000 per org
Dyan Anggraini;4 tahun lalu;Positif;Bukit Jaddhih;Bekas tambang kapur yg jd obyek wisata
Eric Juanto;setahun lalu;Positif;Bukit Jaddhih;"Bukit Jaddih tempat tujuan bersepeda yang bagus, pemandangannya bagus dan rintangan yang menggoda,, disarankan memakai sepeda BMX atau MTB, tidak disarankan menggunakan sepeda lipat karena jalanan yang sangat tidak rata.
Bersepeda agak pagi biar tidak kepanasan"
Heroes Agung;4 tahun lalu;Positif;Bukit Jaddhih;Tempat wisata Bangkalan yg terkenal....
Yayangk Rendhy;5 tahun lalu;Positif;Bukit Jaddhih;Kesana waktu itu sampai lokasi ujan ehh di luar lokasi gak hujan .. jadi foto foto nya gak bisa leluasa  .
Tama Uri Prabowo;5 tahun lalu;Positif;Bukit Jaddhih;"Untuk pemandangannya lumayan bagus. Seperti bukit-bukit yang dibelah. Sekilas mirip grand canyon. Hehe. Tapi ini bukit kapur.
Ada kolam renang. Ada danau airnya warna hijau. Di sini anda bisa naik ""getek"". …"
ADIS ADIS;5 tahun lalu;Positif;Bukit Jaddhih;Bagus untuk foto2. Panas bukan main
Ariza Prawira;5 tahun lalu;Positif;Bukit Jaddhih;Pemandangan bagus, akses ga terawat
Mokhamad Ilham;4 tahun lalu;Positif;Bukit Jaddhih;Good view hanya saja papan petunjuk arah/tempat parkir sangat minim
lakilaki laku;2 tahun lalu;Positif;Bukit Jaddhih;wisata yang unik dan tidak menguras kantong
aksis mulyana;2 tahun lalu;Positif;Bukit Jaddhih;Rumayan lah bagus
Aldi Ramadiansyah;3 tahun lalu;Positif;Bukit Jaddhih;Tempat wisata alam yang sangat2 bagus tapi sayang tidak dikelola dengan baik dari pihak terkait baik dari pemerintah dan dinas pariwisata daerah tersebut sehingga masih banyaknya pungli2 dari warga lokal yang tidak terkordinasi dan kesannya …
Arief Ardiyanto;2 tahun lalu;Positif;Bukit Jaddhih;Tempat bagus,bagus buat foto2,tapi sayang, adanya pungli dari warga2 sekitar membuat saya merasa kecewa. Tiket masuk 20rb,dapat karcis. Di dalam saat memarkir mobil,didatangi orang,meminta uang parkir sebesar 20rb, saya minta karcis …
Anis Yuans;5 tahun lalu;Positif;Bukit Jaddhih;Pemandangan gunung kapur yg elok dan indah
Hallow;2 tahun lalu;Positif;Bukit Jaddhih;Tempat lumayan. Tapi panas dan banyak tukang palaknya
Bejo Bejan;3 tahun lalu;Positif;Bukit Jaddhih;pemandangan bagus bukit jaddih
Indra Susanto;5 tahun lalu;Positif;Bukit Jaddhih;Salah satu tempat yang wajib dikunjungi kalo ke Madura
Sri Wahyuni;4 tahun lalu;Positif;Bukit Jaddhih;Wisata Bukit Jaddih di Bangkalan merupakan tempat penambangan batu kapur dan masih berfungsi di beberapa lokasi. …
AKHMAD YUSUF;5 tahun lalu;Positif;Bukit Jaddhih;Lumayan. Potensial tapi perlu perbaikan agar bisa jadi tempat wisata yang bagus.
Saiful;3 tahun lalu;Positif;Bukit Jaddhih;Jalan masuk lokasi terjal bebatuan,hati hati bawah mobil/motor
Nurul Eliyanti;4 tahun lalu;Positif;Bukit Jaddhih;Tempat ini akan lebih baik kalau kondisi perjalanannya aman sejahtera tanpa khawatir kelangan. Hmm ~
Suprapto Prapto;setahun lalu;Positif;Bukit Jaddhih;Pemandangan landscap bagus, bisa dikembangkan menjadi kawasan pariwisata yg potensial di Madura. Sayang akses jalan masuk belum memadai
Wahyu Setyawan;4 tahun lalu;Positif;Bukit Jaddhih;"Pengalaman pertama kesana jalan banyak berdebu karna memang gunung kapur.
Pjalanan mnuju lokasi jalan kurang bagus tidak cocok utk mobil sedan, lbih baik pakai APV. Dan paling saya tdk suka terlalu banyak pungli disana..hampir saya …"
Roshad 015 Chanel;setahun lalu;Negatif;Bukit Jaddhih;Barusan siang tadi kesana karena penasaran tapi nyampe sana malah dibikin emosi masih ada punglinya masuk bayar karcis 10rb mau nyampe dilokasi goa putih ada yang narik 10rb lagi tanpa karcis
Diya Fitri;4 tahun lalu;Positif;Bukit Jaddhih;Akses dari jalan raya utama cukup jauh, gang masuk belum aspal dan cukup goyang dombr*t. View bagus dan alami, cuma fasilitas umum masih kurang. Dan bisa dikatakan tidak murah. …
Nur Salim Rozak;5 tahun lalu;Positif;Bukit Jaddhih;Waaaah ini tempat bener bener bagus. Recom banget laah kalau lagi JJ ke madura.  Saran aja jangan pas ujan kalau kesana karena bakal beceek
Jose Wu;5 tahun lalu;Positif;Bukit Jaddhih;Pemandangan bukit kapur yg menawan, cmn panas nya luar biasa...
