user;waktu;sentimen;lokasi;ulasan
Ahmed Baidlowi;4 tahun lalu;Positif;Bukit Jaddhih;Semoga segera mendapat perhatiaan akses dan pelayanan
Rudy Prayitno (Rudy SP);5 tahun lalu;Positif;Bukit Jaddhih;Bukit Jaddih menawarkan pemandangan yang berbeda dengan bukit lain dengan warna dominan putih.  Kondisi bukit dalam proses penataan dan pembangunan secara perlahan dan pasti. Beberapa tempat terdapat alat berat. HTM untuk mobil saja 20.000 …
Edo Renaldi;5 tahun lalu;Positif;Bukit Jaddhih;"Bagus pemandangan dari atas, tapi semakin dikeruk semakin hilang keindahannya

Silau juga"
Herman Darmansjah;setahun lalu;Negatif;Bukit Jaddhih;Saat ini tempat wisatanya sdh ditutup karena sdh rusak berat akibat kegiatan penambangan batu putih (kapur) yang masif.. jalan aksesnya sdh rusak juga akibat repetisi beban roda² truk pengangkut batu..
Arif C. Permana;3 tahun lalu;Positif;Bukit Jaddhih;Wisata alam yg bagus...cuma syg ketika kesana airnya lgi kering...
Silva Ardianti;4 tahun lalu;Positif;Bukit Jaddhih;Tempatnya bagus instagramable banget,bisa juga untuk foto prewedd
Santi Nuryani;setahun lalu;Positif;Bukit Jaddhih;"Lokasi tambang batu kapur yg bagus untuk jadi spot foto2.
Tempat masih bersih belum terlalu rame.... Tiket masuk juga murah."
dauliyatu achsina;3 tahun lalu;Positif;Bukit Jaddhih;Bukit jaddih. Dua kali kesini pertama sekitar tahun 2012. Yang kedua 2019. Banyak yang berubah yang paling utama adalah bentuk garukan tambang. Tapi aku lebih suka yang ini. Saya kasi rating 5 kenapa. Karena bagus banget buat foto. Tapi ada …
Akhmad Santoso;4 bulan lalu;Positif;Bukit Jaddhih;Tempatnya bagus ......sayang bayarnya mahal
Ojan Mps;6 bulan lalu;Negatif;Bukit Jaddhih;kotor, fasilitas tidak ada, ada maling tapi sempat ketahuan
aP Putri;setahun lalu;Positif;Bukit Jaddhih;Kereeen, pinter pinter cari spot foto aja, pasti keren, jalan menuju kesana memang kurang bagus, tapi masih bisa di lewati. Terus ada beberapa kali bayar, tapi ya masih wajar. Semoga tempat ini lebih baik lagi di kembangkan dan di pelihara
Ikhman Achmad Ayyub;2 tahun lalu;Positif;Bukit Jaddhih;"Jaddih - Riwayatmu kini -
Dari sebuah Bukit kecil indah sampai Hari ini sebagai kawasan yang bahkan menurutku sudah tak layak lagi disebut sebagai sebuah Tempat Wisata. …"
abid aqila;5 tahun lalu;Positif;Bukit Jaddhih;Lokasi bagus cuma belum ada tempat utk anak-anak..hanya berupa tebing
bunda chaca 13 bahagia;5 tahun lalu;Positif;Bukit Jaddhih;"Pegunungan kapur yang sangat luas.
Masih aktif kegiatan penambangan nya. Untuk menuju ke lokasi disarankan datang dengan rombongan bagi pengendara kendaraan roda dua serta dengan pengawalan …"
Wisnu A.W;5 tahun lalu;Positif;Bukit Jaddhih;"hal positif : bukit kapur buatan indah ada kolam renang, perahu dan berkuda. desain arsiteknya menarik . cocok untuk wisata keluarga.
hal perlu di perhatikan. aktifitas penambangan batu kapur banyak kendaraan …"
A Jun41;setahun lalu;Negatif;Bukit Jaddhih;"Tidak ada petunjuk arah ke objek wisata
Bagi orang yg pertama kali ke situ pasti bingung, hanya mengandalkan GPS saja"
dhimas chrisnata;4 tahun lalu;Positif;Bukit Jaddhih;sangat indah .. bila sudah ramai pasti juga bakal terawat lagi dan fasilitas akan lebih banyak lagi
agunk gunawan;4 bulan lalu;Positif;Bukit Jaddhih;Ini mah asli keren parah view nya
Muhammad Zaenuri;4 tahun lalu;Positif;Bukit Jaddhih;Wisata alami, pemandangan yang berbeda dibanding dengan lain
Dodik Wazzt;4 tahun lalu;Positif;Bukit Jaddhih;Bagus Sekali Viewnya..
gita pu;setahun lalu;Negatif;Bukit Jaddhih;Tidak tertata, petunjuk masuk tidak ada, tiket sangat mahal, tidak ada fasilitas yang berfungsi, hanya hanya truck pasir
KYUHAR;3 tahun lalu;Positif;Bukit Jaddhih;Tempat Wisata ini Hampir mirip dengan tempat wisata Pantai Pandawa di Bali! ?? …
FunnyFanGirl Rosu;5 tahun lalu;Positif;Bukit Jaddhih;Bukit kapur ini masih dlm tahap pemahatan dan perluasan tambang...jadi harap hati2 karena banyak kendaraan besar di sekitar lokasi..juga masil belum di koordinir dg baik sbg tempat wisata..jadi utk masuk ke tempat ini ada 3x pembayaran... …
kholidatul khoiriyah;2 tahun lalu;Positif;Bukit Jaddhih;"Serasa lagi di bukit manaaa gitu. Hehe RT
Padahal di madura."
Rohmatun Nazila;4 tahun lalu;Positif;Bukit Jaddhih;"Bagus..., tapi agak mendebarkan....
Tidak ada pagar pengaman untuk pengunjung yang berada di atas..."
Ira Luvyra;5 tahun lalu;Negatif;Bukit Jaddhih;Bukit Jaddih ini semacam bukit kapur yg masih terdapat penambangan aktif. Sepertinya belum dikelola secara resmi oleh Dinas Pariwisata setempat. Jadi masih banyak pungli. Dan keamanan belum terjamin. Jatuhnya bisa sangat mahal hanya untuk …
Supriyadi Jatirejo;2 tahun lalu;Positif;Bukit Jaddhih;Bagus saya suka, cuma ases jl saja perlu diperbaiki
mahmud dede;3 tahun lalu;Positif;Bukit Jaddhih;Tempatnya bagus, tapi panas banget gak bisa lama-lama, hehhe
INDAH WULANDARI;5 tahun lalu;Positif;Bukit Jaddhih;Sensasi tambang bukit kapur yg eksotis
ASIH .Gresik;5 tahun lalu;Positif;Bukit Jaddhih;Indah tapi panas, banyak bayar parkirnya
mbak iga;4 tahun lalu;Positif;Bukit Jaddhih;Bukit Jaddih adalah bukit kapur yang masih aktif penambangan kapurnya, terletak di madura, desa Jaddih Bangkalan. Wisata ini masih baru dan belum dikelola dengan baik. …
Dwi Suharyanto;5 tahun lalu;Positif;Bukit Jaddhih;Pemandangannya luar biasa bagus lahan luas ada kolam renang, danau, serta. Gua tetapi setiap masuk ke dalam danau, kolam renang itu bayar di jalan mau masuk aja bayar. Menurut saya itu pungli karena karcisnya gak ada stempel, lambang, atau …
Tri Alin Arsalaan;setahun lalu;Negatif;Bukit Jaddhih;"Tiket masuk kendaraan roda dua 10000 untuk roda empat 25000
Tiket masuk kolam renang untuk kendaraan roda 2 (yang airnya gak bersih) 25000 untuk roda 4 40000+ …"
Tio Arifiadi;5 tahun lalu;Negatif;Bukit Jaddhih;Bayar 10 rb tiap mau masuk lebih jauh
discoverun;9 bulan lalu;Positif;Bukit Jaddhih;tempat yang bagus untuk berwisata
arif mawan;5 tahun lalu;Positif;Bukit Jaddhih;Musim kemarau sepi, view untuk danau terrible
nikmatul istikhomah;4 tahun lalu;Positif;Bukit Jaddhih;Wisata alam grand canyon nya Indonesia. Tersedia parkir,cafe, warung kecil, kolam renang, kamar mandi dan lainnya..Namun sayang belum dibangun mushola, yang ada tempat lenggang dengan tikar seadanya numpang di lapak. Pengunjung bisa …
AP CO;5 tahun lalu;Positif;Bukit Jaddhih;Bagus cuma dikit dikit bayar belok kiri bayar belok kanan bayar masuk sini bayar masuk sana bayar, total abis 60k
Fud4 M;2 tahun lalu;Negatif;Bukit Jaddhih;"- Banyak Pungli, siap siap uang banyak aja
- Tempat wisatanya cuma danaunya, jadi nggak begitu luas, nggak sesuai ekspektasi …"
achmad Burhanudin;5 tahun lalu;Positif;Bukit Jaddhih;Semakin hari semakin bagus... Hanya sayang pengelolaan retribusinya tidak jelas...
Manda Bikova sekar;4 tahun lalu;Positif;Bukit Jaddhih;Tempat wisata yang seru, banyak spot selfie, ada banyak fasilitas dari makanan, souvenir, wisata air berupa perahu dayung. Sayang untuk fasilitas toilet masih kurang memadai, padahal biaya yang di minta dari pendatang cukup banyak. Mulai …
Cimahi_SM Ekstra_Anggih Saeful Khiyar_SM3;4 tahun lalu;Positif;Bukit Jaddhih;Tempatnya dan pemandangannya bagus, kunjungannya menyenagkan. Ada danau juga yang indah
Dr.NinaNila Periodontist;5 tahun lalu;Positif;Bukit Jaddhih;Panas sekali disini dan debu, jadi jangan lupa bawa topi dan kacamata, boleh juga pakai masker agar tidak menghirup debu. Merupakan tempat penambangan bukit kapur yang masih aktif. Bahkan hari liburpun kendaraan besar dan pekerja tambang …
Ardiano Fauzy;4 tahun lalu;Positif;Bukit Jaddhih;Pemandangan di bukit Jaddih sungguh luar biasa.  Bukit kapur ditambang, digali dan dibuka, menciptakan lansekap buatan yang cukup indah.  Ada bukit yang nampak memiliki pintu atau jendela.  Ada ruang terbuka yang memiliki kolam.  Ruang …
johand vahrudin;4 tahun lalu;Positif;Bukit Jaddhih;Suka sekali. Tmptnya indah. Kl ksni jgn lupa pke msker ya. Karena msih bnyak kgiatan jd nya berdebu.
Anita Novilia Damayanti;3 tahun lalu;Positif;Bukit Jaddhih;"Post: 24 Juli 2020
Tempatnya sih bagus adem sunyi tenang gt, spot fotonya juga kece. Tapi bayarnya itu dimana² baru masuk ditarik 10rb turun ke danau pote 1orang 5rb mau naik ke …"
Sita Syahriski;3 tahun lalu;Negatif;Bukit Jaddhih;Pertama kali kesini, pas lagi musim kemarau panjang, jadi tempatnya kering gak ada air sama sekali. Saran saya semoga pihak pengelola menambah tempat sampah di sekitar tempat wisata, karena banyak sekali sampah berserakan yang mengurangi …
Traksi Ardi;4 bulan lalu;Positif;Bukit Jaddhih;"Terbaik
Lokasi nyaman
Pelayanan sangat baik dan ramah"
Ahmad Nazori;3 tahun lalu;Positif;Bukit Jaddhih;Akses masuknya sempit, tambang batu kapur masih aktif, jadi jalan berdebu tebal.. Papan petunjuk lokasi resmi pemda belum ada, lokasi bagus, malah ada kolam renang sewa segala.. Buat selfie ok banget, warung warung kopi dan snack/buah lumayan banyak..
Dobel R;5 tahun lalu;Positif;Bukit Jaddhih;"Lumayan, pemandangannya bagus.
Tapi perlu hati-hati ke sini, jangan naik sepeda motor kecuali grup. Sangat tidak aman, bahkan pada siang hari. Bisa jadi wilayah ini terlalu dikuasai preman, …"
Nita Pietersz;3 tahun lalu;Positif;Bukit Jaddhih;"Panas ya gaes..
Bawa kacamata dan Topi..
Yg perawatan bisa pakai sunblock biar gak kaget.. …"
Zulfi Gunawan;4 tahun lalu;Positif;Bukit Jaddhih;Akses jalan ga terlalu lebar, 2 mobil udah mepet. Kalo udah deket lokasi bakal ngebul debu dari batu gamping. Terakhir ke sana waktu 15 Juli 2018 dan masih ada renovasi untuk memperindah kawasan wisata dan melengkapi fasilitas yang dibutuhkan seperti lahan parkir dan jumlah warung jajanan.
Indra Prasetyo;5 tahun lalu;Positif;Bukit Jaddhih;Tempatnya keren,cocok buat hunting,apalagi pas cuaca cerah,pantulan cahaya matahari akan memantul dari bukit kapurnya sehingga ambil gambar dimanapun oke. Perlu bawa pelindung matahari aja karena saat cuaca terik akan terasa panas tetapi …
Chintya Febriyanti;5 tahun lalu;Positif;Bukit Jaddhih;Nice place dengan harga yg murah. Hati2 sama debunya ya
dwi yanto;5 tahun lalu;Negatif;Bukit Jaddhih;Ya begitulah.. Soso..  Panas dan berdebu.   Yg bawa mobil siap2 nyuciin
Mas Resa;5 tahun lalu;Positif;Bukit Jaddhih;Wisata alam untuk mengisi liburan
Andini;5 tahun lalu;Positif;Bukit Jaddhih;Tempatnya keren, banyak spot foto
Agus Budi Santoso;4 tahun lalu;Positif;Bukit Jaddhih;"Perbukitan kapur yg sangat eksotis??tapi sayang tdk di dukung oleh tempat istirahat yg nyaman, tdk ada tenda"" yg nyaman, hny ada beberapa warung"" kakilima, padahal restribusi sudah lumayan lancar, masuk per kepala Rp 5000, parkir Rp 20.000. Semoga makin ditingkatkan kondisi yg sekarang …"
Yogi Dwi Prasetyo;5 tahun lalu;Positif;Bukit Jaddhih;Bukit jaddih terletak tidak jauh dari jembatan Suramadu, hanya berjarak sekitar 16 km. Jadi bila anda jauh-jauh dari daerah anda untuk merasakan sensasi jembatan suramadu, alangkah ruginya bila anda tidak sekalian mampir ke bukit Jaddih. …
Quenyan Warrior;4 tahun lalu;Positif;Bukit Jaddhih;"Mengesankan, lebih bagus dibanding tebing breksi Yogjakarta.
Dana yang harus dikeluarkan, sbg berikut:
1. Ketika melewati jalan tujuan, akan ada kotak sumbangan sukarela. Beri …"
Masday Wulan;4 tahun lalu;Positif;Bukit Jaddhih;Bukan hanya melihat pahatan kapur saja, kita juga bisa melihat bukit bukit yang hijau dan indah disekitar sana. Ditengah tengah bongkahan kapur tersebut terdapat seperti danau yang diberi nama aeng goweh pote. Mata air itu muncul dari …
Budi Suryawan;2 tahun lalu;Positif;Bukit Jaddhih;Tempat cukup bersih dan menarik, tapi sayangnya kebanyakan pungutan masuk, pertama mau masuk lokasi dikenakan 20rb per kendaraan,lalu mau masuk parkir di tarik lagi pungutan 5rb per orang, karena kami ber 4 maka total biaya masuk nya 40rb
beruang sakti;5 tahun lalu;Positif;Bukit Jaddhih;Bukit ini terbentuk karena aktifitas penambangan kapur pada sebuah bukit kapur yang terjadi puluhan tahun di tempat tersebut, sehingga terbentuklah sebuah panorama mempesona seperti saat ini. Penambangan masih berlangsung sampai sekarang, …
Alan Putra Firmansyah;5 tahun lalu;Positif;Bukit Jaddhih;Tempatnya panas banget kalo siang, kesini mending sore hari
CHOTIBUL UMAM;5 tahun lalu;Positif;Bukit Jaddhih;Panas sih, tapi pemandanannya epic.
erlangga kusumo Widodo;setahun lalu;Positif;Bukit Jaddhih;Eksotis,buat wisata anti mainstream. Kebersihan perlu ditingkatkan. Tdk rekom buat mobil jenis sedan kesini karena medannya bergelombang
Kudi arto;setahun lalu;Positif;Bukit Jaddhih;Tempat instagrammable. Minusnya adalah jalur ke lokasi dan terdapat beberapa pungutan (unofficial). Potensi berkembang lebih baik lagi.
Mamik Sorganingsih;4 tahun lalu;Positif;Bukit Jaddhih;Buat foto2 oke sih.. tapi sayang, gak ada tempat sampah disana. Di beberapa titik ada sampah2 yang berserakan, mengurangi keindahan. Udaranya panas tapi ada angin yg semilir. Parkirnya 20k. Tiket masuk per orang 5k.
Syefira Ramadhani;5 tahun lalu;Positif;Bukit Jaddhih;Tempat wisata nya bagus, apalagi ada mata air nya. Semoga dikelola dengan baik terutama jalan akses ke tempat wisata bisa diperbaiki. Untuk fasilitas yang ada yaitu perahu sampan, kolam renang. Dan semoga nanti ada wisata balon udara kayak …
Putri Larasati Ayuningtias;4 tahun lalu;Positif;Bukit Jaddhih;Wisata paling dekat dengan jembatan suromadu
Fredrik Oktovanus Poerba;3 tahun lalu;Positif;Bukit Jaddhih;Wisata bukit jaddih di socah madura,  pemandangan bukit kapurnya sangat indah,  utk berwisata kesini sebaiknya menyediakan topi atau payung jg memakai sepatu,  krn perlu berjalan kaki dg jalan yg naik turun.  Kiranya pemerintah lebih …
mux mux;4 tahun lalu;Positif;Bukit Jaddhih;Tempatnya bagus, tapi akses kesana jalannya perlu diperbaiki
RNS Novita;4 tahun lalu;Positif;Bukit Jaddhih;Pemandangan saat sunset sangat bagus, untuk foto foto keren kaya ada salju salju nya gitu, cuma jangan terlalu sore turun nya, karena perjalanan Medan nya masih sangat sepi, jd untuk meminimalisir resiko apapun sebaiknya turun sebelum magrib.
Wahyu Pramusinto;setahun lalu;Positif;Bukit Jaddhih;"Tempat ini sulit dijangkau karena lokasinya yang jauh dari jalan utama.
Spot foto berupa gunung kapur yang dikeruk dan berlubang membentuk goa yang eksotis. …"
Reza Abraham;4 tahun lalu;Positif;Bukit Jaddhih;Tempat yang bagus buat foto
esa mariya ajikan;4 tahun lalu;Negatif;Bukit Jaddhih;Panas n airnya sudah keruh
L154 Yn;4 tahun lalu;Positif;Bukit Jaddhih;View nya bagus tapi panas bukit kapur.
Rohmatulloh;setahun lalu;Negatif;Bukit Jaddhih;"Tidak sesuai ekspetasi
Wisatanya tidak seperti dulu lagi"
Diary Denok;2 tahun lalu;Negatif;Bukit Jaddhih;"Dari jembatan suramadu tidak jauh krg lebih 30menit sudah sampai.di tahun 2020 saya pergi lagi kesini.
Dan wkt itu danau kering karena musim hujan,masuk wisata dipalak 3x (pungutan …"
Mohammad Aditya Putra;5 bulan lalu;Positif;Bukit Jaddhih;Bagusss
Mas Tata;4 tahun lalu;Negatif;Bukit Jaddhih;Cuaca panas banget n berdebu, bukit ini sebenarnya bukit kapur yang dikelola oleh salah satu perusahaan, karena proses pengambilan yang sudah berbentuk kotak maka bukit ini seperti terpotong terkotak2, kendaraan bisa dibawa naik keatas …
Rendi S;3 tahun lalu;Negatif;Bukit Jaddhih;Panas,bawa payung dan masker ya...
Desy Tri Susanti;5 tahun lalu;Negatif;Bukit Jaddhih;Aksesnya masih kurang, terutama untuk mencapai puncak tebingnya. Belum ada pengaman di sisi sepanjang jalan. Saya sarankan untuk membawa payung dan topi pada siang hari karena amat sangat panas. Jangan lupa juga pake sunblock/sunscreen ya ?? …
Arie Wirawan;setahun lalu;Negatif;Bukit Jaddhih;Airnya hijau lumut, bukan biru. Bnyk banget punglinya. Sampai tujuan hrs bayar pungli 3 kali. Dan danau kotor bnyk sampah.
Anselmus Haryo;5 tahun lalu;Positif;Bukit Jaddhih;Katanya panas padahal ngak juga
Eri Yadi Setiawan;4 tahun lalu;Positif;Bukit Jaddhih;Kerennnn, cuma panas aja kalo sudah siang
sulastri rianti;4 tahun lalu;Positif;Bukit Jaddhih;Di Bukit jaddih panas jd harus pakai sun block ya gaes...
Hadi Parliyandi;3 tahun lalu;Positif;Bukit Jaddhih;Bukit tempat penambangan kapur, ada spot foto yang cuma bagus di foto instagram namun tidak cocok untuk ajak keluarga. Ada Goa Pote dan kolam pemandian dibekas penambangan kapur. Masuk lokasi ini cukup banyak pungli dan tidak sesuai dengan …
Merry Tauho;4 tahun lalu;Negatif;Bukit Jaddhih;Sebenarnya tidak pantas diberi bintang. Tempat wisata seharusnya tertata, tidak ada tumpukan2 sampah. Itu hanya tempat penambangan tanah putih, banyak mobil2 pengeruk tanah dan truk. Parahnya lagi, banyak preman pemungut tiket liar (tiket …
A ang;5 tahun lalu;Positif;Bukit Jaddhih;untuk pengalaman pemandangan yang bagus disarankan datang saat musim panas, atau peralihan ke musim hujan, kira kira bulan juni sampai desember, karena saat itu rumput rumput telah menguning dan pemandangannya pun tidak kalah dengan bukit …
KARYA SEJATI;3 tahun lalu;Negatif;Bukit Jaddhih;Manusia mencari uang ulet spt itu
Reno Dewanta;5 tahun lalu;Positif;Bukit Jaddhih;Sangat potensial tapi masih butuh perawatan dan arena permainan
G_Revitha Febrysanty H_317;2 tahun lalu;Positif;Bukit Jaddhih;"Salah satu wisata alam di Madura yang wajib dikunjungin, tempatnya keren.
Tetapi sayangnya banyak pungli, semoga kedepannya tidak banyak pungli dan lebih aman …"
Widya Permata Sari;3 tahun lalu;Negatif;Bukit Jaddhih;Jalan menuju ke tempat ini kecil banget (cukup 1 mobil aja). Untuk menuju ke lokasi, ada sekitar 3 kali bayar uang masuk (ga lebih dari 20rb sih). …
Alika Family;4 tahun lalu;Positif;Bukit Jaddhih;Bagus buat foto tapi puaanass bgt.
Herna Widiya;2 tahun lalu;Positif;Bukit Jaddhih;"Tempat y bagus
Tp sayang bayar trs?? …"
saiful bahri;2 tahun lalu;Positif;Bukit Jaddhih;Jalur gowes terdekat dari surabaya
Mas Bur;4 tahun lalu;Positif;Bukit Jaddhih;Bagus akan tetapi terlalu banyak pemalak berkarcis
Andri Advan;5 tahun lalu;Positif;Bukit Jaddhih;Bagus alami...cm syng bnyk pungli
Roni Wijaya;4 tahun lalu;Positif;Bukit Jaddhih;"Pos 1 bayar seikhlasnya bilangnya buat buka jalan (koq mirip pungli)
Pos 2 bayar 5ribu per orang (ada tiket)
Pemandangan cukup bagus hanya saja tata kelolanya gak jelas. Ada danau seluas …"
IMRON ROSYADI;4 tahun lalu;Positif;Bukit Jaddhih;masih dalam proses. semoga kalau sudah selesai makin bagus
Syah Roni;4 tahun lalu;Negatif;Bukit Jaddhih;Pengen terkenal kok banyak pungli  begal gak jelas banget,kalo pengen di eksplor tempatnya harus ramah dan jangan melakukan kejahatan.. Pasti destinasinya nanti akam rame, kalo rame kan enak bakal banyal penghasilan dan bertambahnya tenaga kerja jadi tukang parkir dsb
Anjani Saraswati;2 tahun lalu;Positif;Bukit Jaddhih;bagus sih cuman sayang airnya skrg warnanya ijo wkwk beda sama foto2 yg digugel msh biru. terus banyak sampah juga... semoga kedepannya bisa lebih memperhatikan kebersihan baik pengelola dan pengunjung
ig : naungansurya;4 tahun lalu;Positif;Bukit Jaddhih;"Bukit Kapur Jaddih, Wisata di Bangkalan Madura yang Bagus Buat Hunting Foto

Travel Destinations4.9K …"
Kumi Peski;setahun lalu;Positif;Bukit Jaddhih;Spot utk foto lumayan bagus , saran yg ingin kesana yg bagus pagi atau sore krn kl siang cuaca panas
Reni Yuniayati Sandra Boiyani;setahun lalu;Positif;Bukit Jaddhih;"Lebih baiknya Pergi waktu sore hari /pagi hari ,karena Siang panas bangat Dan berdebu juga ,
Tapi lumayan pemandangannya ,mantap"
hetty2 pratiwi;4 tahun lalu;Positif;Bukit Jaddhih;Mudah ditemukan, pake Google map pasti ketemu tempatnya. Krn kesana sore jd ndak terlalu panas apalagi saat musim kemarau, jd kering ndak ada danaunya. Lumayan bagus tempatnya, apalagi yg suka ndaki. Batu kapurnya lumayan eksotis, apalagi pas matahari mau terbenam, siluet cukup menawan. Hanya sayangnya, jalan kelokasi blm bagus.
M Umar;2 tahun lalu;Positif;Bukit Jaddhih;"Sebenar nya bagus dibuat wisata keluarga atau wisatawan luar kota,, cuman sedikit kurang sentuhan, tata kelola dan pengelolaan,, jd terkesan tidak terurus..
Kayak wisata bukit jeddih perlu studi banding ke stigi yg berada di kawasan …"
Aaron Valentinus;3 tahun lalu;Positif;Bukit Jaddhih;Jalan menuju bukit lumayan tidak rata, dan agak sempit, saat musim panas tidak terlalu rekomend karena panas dan debu tapi di dalem goa lumayan dingin, harga tiket masuk danau goa'pote Rp5.000 perorang, pemandangan nya juga unik instagramable, tapi saat saya datang danaunya sedang agak kering. Mantap bagus
Lutfi EstilLo;2 tahun lalu;Positif;Bukit Jaddhih;Tempat buat rekreasi kluarga yg menawarkan pemandangan dri atas bukit, tapi tiap pindah tepat bayar karena beda wilayah .. …
unromanticromeo;4 tahun lalu;Negatif;Bukit Jaddhih;Lokasi lumanyan jauh dan masuk jalan desan yang kecil tp bisa dilalui 2 mobil. Udara sangat panas dan berdebu karena memang daerah perbukitan dan merupakan penambangan batu kapur yang masih aktif. Saran saya jangan datang / pulang terlalu …
Madichur Rochman;3 tahun lalu;Negatif;Bukit Jaddhih;Wew... Baru masuk jalan kampun Pungli, masuk pos pertama mau nanya tempat parkir ditarik Pungli lagi, masuk portal Pungli lagi. Belom lagi klo pas naek ketempat yg lebih tinggi ketemu pria berkuncir minta duit lagi. …
hary setyawan;4 tahun lalu;Negatif;Bukit Jaddhih;Ini sebenarnya tempat penambangan gunung kapur yg masih aktif. Sama warga du bentuk sedemikian rupa menjadi sebuah obyek wisata. Tiket masuk sangat mahal untuk sebuah tempat seperti ini. Tiket Motor 10rb Mobil 20rb Bus kecil 80rb. Belum …
priyadiVlog doors;4 bulan lalu;Positif;Bukit Jaddhih;suka sesuatu yang beda? langsung merapat kesini kereeen.
Willdan Pramanda Wahyudi AdiSlamet;5 tahun lalu;Negatif;Bukit Jaddhih;Nice Place , sayang banyak pungli
yossinda dp;5 tahun lalu;Positif;Bukit Jaddhih;datang pagi atau sore biar tidak panas
Mazaya Azkya Faradis;4 tahun lalu;Positif;Bukit Jaddhih;Wisata bukit Jaddhih adalah tempat wisata yang unik dan tidak biasa. Dikatakan tidak biasa karena memang bukan merupakan pegunungan pada umumnya. Kita bisa menikmati pemandangan yang luar biasa dati atas gunung gamping yang semakin terlihat …
E Loeminto;5 tahun lalu;Negatif;Bukit Jaddhih;Tidak ada pemandangan hijau selain kapur putih. Terlalu panas dan terik matahari menyengat. Mungkin sorean lebih nyaman. Tidak ada biaya yang di charge untuk masuk ke sini. Saran ku mending kamu ke Bukit Arosbaya
Jairus Robert;4 tahun lalu;Positif;Bukit Jaddhih;Tempat wisata yang cantik berupa danau dan gua batu kapur buatan manusia sisa dari proyek penambangan batu kapur. Perjalanan menuju lokasi cukup ekstrim sehingga butuh skil berkendara yang cukup baik. Tempatnya bagus untuk foto-foto. Harga tiket masuk 20ribu permobil dan 5ribu perorang.
Micky Saputra;2 tahun lalu;Positif;Bukit Jaddhih;Banyak tarikan soob alias pungli... Siapin duit yg banyak. di jalan masuk desa ada tarikan. di pos jalan masuk tambang ada tarikan lagi, di pos masuk ke aprkiran ada tarikan lagi....  tempat udah tidak seindah dan sebersih di foto-foto …
IRUFANO;5 tahun lalu;Positif;Bukit Jaddhih;Tempatnya sangat recomended untuk pesona keindahan tebing kapur dan waduk biru toska
RiznurS;5 tahun lalu;Positif;Bukit Jaddhih;Tempatnya bagus tapi masih perlu perapihan
Helen Samantha;4 tahun lalu;Positif;Bukit Jaddhih;Lumayan lah buat swa foto..tp siapa yg kelola tmpt ini? Kok bnyk pungutan liar? Msk pertama mnt uang, msk kdua mnt uang lg enggak ada karcis nya..nah parkir mbl pun mnt uang lg muka2 preman ga jls klo ga d ks maksa se olah2 mau telan orng tu tampang2 nya.cb kelola dng yg bnr..sedia kn wc
Mohamad Rosul;5 tahun lalu;Positif;Bukit Jaddhih;bukit jaddih seperti halnya padang pasir..hahahah
HAIDAR FADHIL;2 tahun lalu;Positif;Bukit Jaddhih;"Tempat bagus,
Masalahnya ada 3 lapis pungutan karcis.
Yg 1 ada karcis …"
Julie Khriss;2 tahun lalu;Positif;Bukit Jaddhih;KEREN buat foto2
Suliyah Widia;3 tahun lalu;Negatif;Bukit Jaddhih;Karena waktu masuk lokasi bayak preman pertama dah masukin kas desa gk pp kedua pintu masuk di tarik uang 40 rb itu juga gk jelas..di parkiran per orang suruh bayar 5 rb..masuk kawah di tarik uang lg perorang 5 rb..aq sangat gk suka tempat itu sangt kecewa!!!!!!!!
Mazaya Yumna;4 tahun lalu;Positif;Bukit Jaddhih;Unik dan bagus, serba putih gitu karna perbukitan kapur. Udah mulai di mulai berkembang juga pariwisata nya, ada yang lagi dibangun, ada juga yg udah ada fasilitasnya, ada juga yg lagi ditambang kapurnya. Boleh deh buat liburan, mungkin jalan nya aja yg masih belum bagus dan banyak pungli nyaa hehe?
Vera Kuslelyana;3 tahun lalu;Negatif;Bukit Jaddhih;Kurangnya papan petunjuk membuat pengunjung kesasar.
Rani Monikasari;4 tahun lalu;Positif;Bukit Jaddhih;Planning aku prtama kli mnginjak kaki di madura pgn banget ke bukit jaddih dan alhamdulillah terealisasi gaes ??kabar baiknya tempatnya kuueren banget ya meskipun masih dalam proses pmbangunan yg lebih baik. Kayknya di atas danau tuh kyak …
Papa Rasya;5 tahun lalu;Positif;Bukit Jaddhih;Mantap keren sekali view nya dan banyak spot foto Instagramable... Cuman masuk nya bayar lagi kalo yang ada kolam SM goa pote. Di depan pintu masuk bayar 16 ribu kalo ke kolam yg ada d gambar bayar lagi 10 ribu SM parkir 2000. Tapi kalo langsung ke atas bukit gak bayar lagi bisa naik muter lewat jalan yang d laluin truk truk...
Hus Ni;4 tahun lalu;Positif;Bukit Jaddhih;Bukit Jaddih, bebatuan kapur putih yang tersohor karena keindahannya. Destinasi yang menjadi perbincangan di media sosial ini akhirnya menyedot orang-orang berbondong-bondong mengunjunginya. …
Dinda Ayu Imaningrum;3 tahun lalu;Negatif;Bukit Jaddhih;Untuk foto prewedd mahal, tanpa informasi yg jelas.. dikenakan biaya 200k disaat masih ada aktifitas penambangan... mohon pengelolahan diatur dengan benar agar lebih baik kedepannya
Siswanto Jablud;setahun lalu;Positif;Bukit Jaddhih;Sebetulnya potensial menjadi obyek wisata yg megah,  tapi saat ini minim pengelolaan dan jalan menuju ke lokasi sangat sempit dan rusak.
